timestamp_coleta,ticker,id,titulo,descricao,url,fonte,data_pub,termo_busca,sentimento_pt,sentimento_en,confianca,score_positive,score_negative,score_neutral,texto_analisado,erro
2026-06-19T19:03:51,PASS3,a2f432f4f7e7,"Citi, JPMorgan e Itaú BBA iniciam cobertura da Compass (PASS3) com recomendação de compra","Citi, JPMorgan e Itaú BBA iniciam cobertura da Compass (PASS3) com recomendação de compra&nbsp;&nbsp;Estadão",https://news.google.com/rss/articles/CBMi3gFBVV95cUxPVENxdTl1SGIyb0VaeU1CT3VyTlRHNGZXdk56Smt3S1pPaXZOTmVFSi12Z295aTZQLUxNYmpFSmNHVFBxOE12ejlOT2VqU1BoR0ZhTTJPVTN3YUVxcFlkVmlDX0xPR2Q0RWQ3bzhuUWlFWFU0U2hxaVBZVHhXTnRPaFplUUtmVm5uMDJlSFJxR0FYM3hMSUJrRzdKN3ktSkg1NnZUekc1VHJfbDZlUkN0Wi1YaWUySlJVZkI5LVl4NDBmdUkwYm9ZMXRDQjFYVUJaamdQZ3llc1haQ1V0akHSAeMBQVVfeXFMTjNnR2lnMFB2NmFoXzBRMEVlWFpHZ3BYamIzbXpVMXpORlZrRVJhdndCQ0lXcjNtVGlDakpSWmlhR1A3SENaSndBRXNFeU85SkV1TEZ5M0MwZVBOWnhsWl9nWmU2Y2k0RXdySVBjZFhfODdGRW9RUGtJRWlwTjVkak9vN1RQaC1Gek1JYVJVRUJTRGVrU0ZlSFYwMktTX29oc19rZFY0M1hfUE1YLUtHTjBhN3hTMlVnRm9SRE51X0VNZlM4QktEZmY0M2h2a2tsSFZnUU1EQ2htcmpUbTBaY05rcWc?oc=5,Estadão,2026-06-17T22:39:45+00:00,PASS3,INCONCLUSIVO,INCONCLUSIVO,0.0,0.0,0.0,0.0,"Citi, JPMorgan e Itaú BBA iniciam cobertura da Compass (PASS3) com recomendação de compra. Citi, JPMorgan e Itaú BBA iniciam cobertura da Compass (PASS3) com recomendação de compra&nbsp;&nbsp;Estadão",No module named 'transformers'
2026-06-19T19:03:51,PASS3,8437c62dc702,PASS3 ganha aval de grandes bancos e pode subir até 52% após IPO,PASS3 ganha aval de grandes bancos e pode subir até 52% após IPO&nbsp;&nbsp;arevista.com.br,https://news.google.com/rss/articles/CBMimgFBVV95cUxPczBJd2hKQ2RwOHVlZzNNbTBFakJSMGNyalEtTFRQSnZYaThuUEcwdzFNWVJoMlBLUkgzQVRIRHEwSlpzay1paE02MzhhWVdfUUd0alR6RVRURnBUUHpBdS05ZDgzbXJPUmk1SHRyd0lDWFBvdnBKazZJaFczWTRNX0xOdDlFUmhTN3RKZ0EyMzVsbXlSZ1Exc1Nn?oc=5,arevista.com.br,2026-06-19T16:30:29+00:00,PASS3,INCONCLUSIVO,INCONCLUSIVO,0.0,0.0,0.0,0.0,PASS3 ganha aval de grandes bancos e pode subir até 52% após IPO. PASS3 ganha aval de grandes bancos e pode subir até 52% após IPO&nbsp;&nbsp;arevista.com.br,No module named 'transformers'
2026-06-19T19:03:51,PASS3,93e511b82050,Compass [PASS3]: a joia da coroa da Cosan que resiste ao cenário macro adverso,Compass [PASS3]: a joia da coroa da Cosan que resiste ao cenário macro adverso&nbsp;&nbsp;tradenews.com.br,https://news.google.com/rss/articles/CBMicEFVX3lxTE41WDkwUmlQeVRGYjNkLW5Lc3FpMFFUeVFxWVpCcjN2T0FXb0o4bEdBaDdTLTFTVjRkVnZKWFpFQ1FkUkFtaXFmbG12TTFldWczZ25JcW53N1A0M0U0MHRpZU0wS3lENzAzMW5VaGh6Y00?oc=5,tradenews.com.br,2026-06-18T18:01:39+00:00,PASS3,INCONCLUSIVO,INCONCLUSIVO,0.0,0.0,0.0,0.0,Compass [PASS3]: a joia da coroa da Cosan que resiste ao cenário macro adverso. Compass [PASS3]: a joia da coroa da Cosan que resiste ao cenário macro adverso&nbsp;&nbsp;tradenews.com.br,No module named 'transformers'
2026-06-19T19:03:51,PASS3,6501afb16592,PASS3 projeta valorização superior a 50% com recomendações de compra,PASS3 projeta valorização superior a 50% com recomendações de compra&nbsp;&nbsp;Acionista.com.br,https://news.google.com/rss/articles/CBMimAFBVV95cUxPeXpHT21BQjJxLTlMeGhGQVF0WHRSMHpVanhJTFRuVE9Zdk9VeGtPZlV5TmZoRFp1Z185WDY3dWZ2X1ZxY2FYejllRGVwY3VWaWNOZzN4eTJYc3dPcm9teGVMOVl0dGJaczNVLWZaejJhR3dKU2V2cXVVU3dLdFhUQWNTcTlfa0Jab2I5S2F6OU9KbjFMVXIySw?oc=5,Acionista.com.br,2026-06-18T10:44:36+00:00,PASS3,INCONCLUSIVO,INCONCLUSIVO,0.0,0.0,0.0,0.0,PASS3 projeta valorização superior a 50% com recomendações de compra. PASS3 projeta valorização superior a 50% com recomendações de compra&nbsp;&nbsp;Acionista.com.br,No module named 'transformers'
2026-06-19T19:03:51,PASS3,15a530bd9989,Compass (PASS3): cinco bancos veem alta de até 49% e apontam erro do mercado,Compass (PASS3): cinco bancos veem alta de até 49% e apontam erro do mercado&nbsp;&nbsp;Guia do Investidor,https://news.google.com/rss/articles/CBMiswFBVV95cUxPY2hTVGduakFZNUZxamFhcWFXUFZZUm5JSkVwQW5ESmRkSkhnRTkwNWItelJrbmt0a09DUmFBTEZnNllZTHVZaHVkNXo3RHN5clduQi1zUFI5M19Sby1FeHIwUVlSa3pUbTlfa0prMUJ4ZFhfclBOUy16cF9FV0xxbjJSaHlmVmkyYWdYTjd6TDhvTGdlN1FZZ1JVOGJsRjJ5NjlKVk5uekdNS0hzeVVyd3YzRQ?oc=5,Guia do Investidor,2026-06-18T15:21:11+00:00,PASS3,INCONCLUSIVO,INCONCLUSIVO,0.0,0.0,0.0,0.0,Compass (PASS3): cinco bancos veem alta de até 49% e apontam erro do mercado. Compass (PASS3): cinco bancos veem alta de até 49% e apontam erro do mercado&nbsp;&nbsp;Guia do Investidor,No module named 'transformers'
2026-06-19T19:03:51,PASS3,0da4ad0ad7a2,PASS3 com preço-alvo de R$ 33 e valorização de 32%,PASS3 com preço-alvo de R$ 33 e valorização de 32%&nbsp;&nbsp;Acionista.com.br,https://news.google.com/rss/articles/CBMif0FVX3lxTE03RElkdzFzcUI2bl8wdkdLaVRveHhqMFlpb1ZlU3M1YVo0c29NMnQwZGRaRGZ0MTVmSno1eVlYbFpKVjdpd0liVUFpckc1NWRpemNjWDZDczRKZzBKQjVfMnVOMEdKMTVhMzhKaDhEN3hXOGVyYjdfaWd6NmtpbDg?oc=5,Acionista.com.br,2026-06-18T17:42:20+00:00,PASS3,INCONCLUSIVO,INCONCLUSIVO,0.0,0.0,0.0,0.0,PASS3 com preço-alvo de R$ 33 e valorização de 32%. PASS3 com preço-alvo de R$ 33 e valorização de 32%&nbsp;&nbsp;Acionista.com.br,No module named 'transformers'
2026-06-19T19:03:51,PASS3,dcd8cc10981b,Por que esta empresa da Cosan (CSAN3) pode ser uma máquina de dividendos?,Por que esta empresa da Cosan (CSAN3) pode ser uma máquina de dividendos?&nbsp;&nbsp;Money Times,https://news.google.com/rss/articles/CBMiqgFBVV95cUxPUmlwQU1FbFMyUTBfa1VTVG9fMkVFMlRGdXNqaW1kbnVqTjNhMmx6M1o5SHdwQV9FejBFWHp0eThoTC1pMVNVaHNCeVBaZlJBTkRTbDhmc19uNG9iQVItSXBmQUtQUFNvUnQ4Y19QNU92SnllR0Vmd0VMM2p2RUJORU9PRHpubXRYWEtTX2lNMkh1dGJWUEc2RUtYRHptVGdJQnZMS3V1T0dGdw?oc=5,Money Times,2026-06-18T15:21:00+00:00,Comgás,INCONCLUSIVO,INCONCLUSIVO,0.0,0.0,0.0,0.0,Por que esta empresa da Cosan (CSAN3) pode ser uma máquina de dividendos?. Por que esta empresa da Cosan (CSAN3) pode ser uma máquina de dividendos?&nbsp;&nbsp;Money Times,No module named 'transformers'
